{
  "$schema": "https://json-schema.org/draft/2020-12/schema",
  "$id": "http://10.173.59.30:9080/pluginpuller/dsh-desktop-plugins/handoff.schema.json",
  "title": "DSH desktop plugin handoff submission",
  "description": "One submission directory per plugin version: handoff.json (this schema) plus the npm-pack tarball it describes. The desktop owner verifies every field against the artifact and the pinned compatibility contract (compat.json) before the version can enter the signed catalog.",
  "type": "object",
  "additionalProperties": false,
  "required": [
    "schemaVersion",
    "plugin",
    "compat",
    "artifact",
    "submitter",
    "evidence",
    "changes"
  ],
  "properties": {
    "schemaVersion": { "const": 2 },
    "plugin": {
      "type": "object",
      "additionalProperties": false,
      "required": ["packageName", "version", "author", "description", "type"],
      "properties": {
        "packageName": {
          "type": "string",
          "pattern": "^(@[a-z0-9-~][a-z0-9-._~]*/)?[a-z0-9-~][a-z0-9-._~]*$",
          "description": "Must equal the tarball's package.json name, character for character."
        },
        "version": {
          "type": "string",
          "pattern": "^(?:0|[1-9][0-9]*)\\.(?:0|[1-9][0-9]*)\\.(?:0|[1-9][0-9]*)$",
          "description": "Stable three-segment version, and it must equal the tarball's package.json version and the submission directory's version segment. The catalog only lists stable releases: prerelease (-rc.1) and build (+meta) segments are refused — publish the stable release instead."
        },
        "author": {
          "type": "string",
          "description": "Who wrote the plugin. The author is not necessarily the submitter — pushing the MR on the author's behalf is fine (submitter.name says who pushed). A plain string with no format enforced: 'sebtang' and 'sebtang@company.example' are both valid."
        },
        "description": {
          "type": "string",
          "minLength": 1,
          "description": "One or two sentences, in your own words, saying what the plugin does — this is the text colleagues read when deciding whether to install, and it must agree with the MR description."
        },
        "type": {
          "type": "string",
          "enum": [
            "tool",
            "skill",
            "docs-and-rendering",
            "vision-and-multimodal",
            "voice-and-audio",
            "memory",
            "workflow-and-automation",
            "git-and-code-review",
            "interface-ui",
            "browser-and-network",
            "other"
          ],
          "description": "The plugin's category, exactly one of the fixed eleven English slugs above (their Chinese translations live in the MR template and the repo README). Pick the closest fit; 'other' is a last resort."
        }
      }
    },
    "compat": {
      "type": "object",
      "additionalProperties": false,
      "required": ["dshRuntimeVersion", "dshCommit", "desktopVersion"],
      "properties": {
        "dshRuntimeVersion": {
          "type": "string",
          "pattern": "^[\\w^~><=| .*-]+$",
          "description": "SemVer range the plugin was tested against, spelled with the characters the range grammar implements (digits, letters, . - ^ ~ > < = | space, *). Must intersect the version pinned in compat.json at verification time."
        },
        "dshCommit": {
          "type": "string",
          "pattern": "^[0-9a-f]{40}$",
          "description": "The deepseek-harness commit you tested against. Must equal compat.json dsh.commit exactly."
        },
        "desktopVersion": {
          "type": "string",
          "pattern": "^[0-9]+\\.[0-9]+\\.[0-9]+$",
          "description": "The DSH Desktop build you smoke-tested with. Must equal compat.json desktop.version exactly."
        }
      }
    },
    "artifact": {
      "type": "object",
      "additionalProperties": false,
      "required": ["file", "sha256", "sizeBytes"],
      "properties": {
        "file": {
          "type": "string",
          "pattern": "^[^/\\\\\\u0000-\\u001f\\u007f-\\u009f`]+$",
          "description": "Bare filename of the tarball sitting next to handoff.json (npm pack output). No path separators, no control characters, no backticks."
        },
        "sha256": {
          "type": "string",
          "pattern": "^[0-9a-f]{64}$",
          "description": "SHA-256 of the tarball bytes. Recomputed by the owner; a mismatch fails the handoff before anything is unpacked."
        },
        "sizeBytes": {
          "type": "integer",
          "minimum": 1,
          "maximum": 52428800
        }
      }
    },
    "submitter": {
      "type": "object",
      "additionalProperties": false,
      "required": ["name", "gitlabHandle", "submittedAt"],
      "properties": {
        "name": { "type": "string", "minLength": 1, "maxLength": 80 },
        "gitlabHandle": { "type": "string", "pattern": "^@[a-z0-9_.-]+$" },
        "submittedAt": { "type": "string", "format": "date" }
      }
    },
    "evidence": {
      "type": "object",
      "additionalProperties": false,
      "required": ["summary", "checks"],
      "properties": {
        "summary": {
          "type": "string",
          "minLength": 20,
          "maxLength": 1000,
          "description": "What you actually exercised: the scenarios run and the observed result, in your own words."
        },
        "checks": {
          "type": "array",
          "minItems": 2,
          "maxItems": 20,
          "items": { "type": "string", "enum": [
            "install-in-dev-workspace",
            "client-face-renders",
            "host-face-works",
            "market-page-loads",
            "settings-save-restart",
            "long-run-stability",
            "other-described-in-summary"
          ] }
        }
      }
    },
    "changes": {
      "type": "string",
      "minLength": 10,
      "maxLength": 500,
      "description": "One-paragraph changelog versus the newest version already listed in the catalog (or 'initial submission')."
    }
  }
}
